{
  "schemaVersion": "1.0",
  "contractId": "control-plane-implementation-001",
  "change": "enable-stage-isolated-subagent-orchestration",
  "stage": "CONTROL_PLANE_IMPLEMENTATION",
  "role": "main_agent",
  "taskIds": ["2.3", "3.1", "3.2", "4.1", "4.2"],
  "executionMode": "CONTROL_PLANE",
  "authoritativeInputs": [
    {
      "path": "openspec/changes/enable-stage-isolated-subagent-orchestration/design.md",
      "fingerprint": "sha256:842e117b614ebd9f4aa251f86480ba3381f138beda5390bd54b1bd282be22156"
    },
    {
      "path": "openspec/changes/enable-stage-isolated-subagent-orchestration/specs/solo-fullstack-ai-delivery/spec.md",
      "fingerprint": "sha256:39ef4891e1e1d29b9ae10a2453fba2c00e8caae507f565ab923f88d4a9673b1f"
    },
    {
      "path": "openspec/changes/enable-stage-isolated-subagent-orchestration/tasks.md",
      "fingerprint": "sha256:a92ed8cb99704afeaa685a0e63fd7f7bc0815048977e897bdd64d22856e8cfc2"
    }
  ],
  "dependencies": [
    "spec-update-control-plane-001",
    "control-plane-red-tests-001"
  ],
  "allowedWritePaths": [
    ".codex/skills/chinamate-fullstack-delivery/SKILL.md",
    ".codex/skills/chinamate-fullstack-delivery/references/handoff-contracts.md",
    ".codex/skills/chinamate-fullstack-delivery/references/role-routing.md",
    ".codex/skills/chinamate-fullstack-delivery/references/stage-routing.md",
    ".codex/skills/chinamate-fullstack-delivery/references/control-matrix.md",
    ".codex/skills-lock.json",
    "README.md"
  ],
  "forbiddenWritePaths": [
    "openspec/",
    "frontend/",
    "backend/",
    "compose.yaml",
    ".git/"
  ],
  "expectedOutputs": [
    "控制面 self-hosting 的角色路由、阶段路由和交接合同说明",
    "Skill 与 README 中受限控制面边界及真实 Result 到 QA/Spec Review 链",
    "稳定后的第一方 Skill hash"
  ],
  "acceptanceCriteria": [
    "控制面身份不进入七个 specialist 路由集合且不新增第八 custom agent",
    "仅允许已确认治理 change、精确文件 allowlist 和 main_agent 控制面执行",
    "控制面 ResultContract 必须由 qa_engineer 与 spec_reviewer 独立复核，EXPERIENCE_REVIEW 不适用",
    "治理测试与合同测试通过，Skill hash 与 lock 一致"
  ],
  "verificationPlan": [
    "python3 -B scripts/test-handoff-contracts.py",
    "python3 -B scripts/test-ai-delivery-governance.py",
    "python3 -B .codex/skills/chinamate-fullstack-delivery/scripts/validate_handoff_contract.py --change enable-stage-isolated-subagent-orchestration --all",
    "git diff --check -- .codex/skills/chinamate-fullstack-delivery .codex/skills-lock.json README.md"
  ],
  "userGates": [
    {
      "name": "UPDATED_SPEC_CONFIRMATION",
      "status": "SATISFIED",
      "evidenceRefs": [
        "conversation:user-confirmation:2026-07-28"
      ]
    }
  ],
  "gitGates": [
    {
      "name": "GIT_WRITE",
      "status": "NOT_APPLICABLE",
      "evidenceRefs": []
    }
  ],
  "status": "ISSUED",
  "persistedBy": "main_agent"
}
