{
  "schemaVersion": "1.0",
  "contractId": "travel-context-backend-003",
  "change": "add-travel-context-and-account-preferences",
  "stage": "BACKEND_IMPLEMENTATION",
  "role": "backend_engineer",
  "taskIds": [
    "2.1",
    "2.2",
    "2.3",
    "2.4",
    "3.1",
    "3.2",
    "3.3",
    "3.4",
    "4.1",
    "4.2",
    "4.3",
    "4.4",
    "4.5"
  ],
  "executionMode": "SUBAGENT",
  "authoritativeInputs": [
    {
      "path": "openspec/changes/add-travel-context-and-account-preferences/proposal.md",
      "fingerprint": "sha256:855b00e5f0df032f15a2ade03d60fcb0f5102087ae277488de7f5b019be27762"
    },
    {
      "path": "openspec/changes/add-travel-context-and-account-preferences/design.md",
      "fingerprint": "sha256:757829f1f7843588e60d6e2373ae2090951f8096ecd4d405413fb2acef5086c7"
    },
    {
      "path": "openspec/changes/add-travel-context-and-account-preferences/specs/backend-account-preferences/spec.md",
      "fingerprint": "sha256:11c1a56ee51ac71dac33ffc66ee1bcbfb0681dd83214714e3a29b13a6454fb83"
    },
    {
      "path": "openspec/changes/add-travel-context-and-account-preferences/specs/backend-account-authentication/spec.md",
      "fingerprint": "sha256:afd3cf558f7e9da0e85fc65dec461d1bffd93885b1f4a69efae6377d0b038ce8"
    },
    {
      "path": "openspec/changes/add-travel-context-and-account-preferences/handoffs/travel-context-spec-confirmation-002/result.json",
      "fingerprint": "sha256:87c4ff412d317ba004a2b6be8f556414ed441a7c98090025c330336a3f06161c"
    },
    {
      "path": "openspec/changes/add-travel-context-and-account-preferences/handoffs/travel-context-api-clarification-005/result.json",
      "fingerprint": "sha256:eedc262ddaf1f609ef1a1c648cf5cead7fce31f5fa09a6519c353351a423463b"
    }
  ],
  "dependencies": [
    "travel-context-spec-confirmation-002",
    "travel-context-api-clarification-005"
  ],
  "allowedWritePaths": [
    "backend/"
  ],
  "forbiddenWritePaths": [
    "frontend/",
    "openspec/",
    "docs/designs/chinamate-auth.pen",
    ".codex/"
  ],
  "expectedOutputs": [
    "旅行上下文与语言偏好的 RED 测试、Flyway/MyBatis-Plus 实现和 API",
    "修改密码与已确认会话轮换策略的 RED 测试和安全实现",
    "后端工程实践合规清单与真实验证结果"
  ],
  "acceptanceCriteria": [
    "实现 tasks 2.1-4.5 且只修改 backend/",
    "数据库结构仅由新 Flyway migration 管理，自定义 SQL 仅使用 Mapper XML",
    "事务、账号隔离、乐观并发、统一错误和敏感日志边界符合确认规格",
    "其他会话撤销、当前三类凭据轮换、旧 Token 作废和原 7 天绝对期限不延长均有测试",
    "目标测试、ArchitectureRulesTests 与适用 MySQL 8.4 集成测试有真实结果"
  ],
  "verificationPlan": [
    "./mvnw -Dtest=ArchitectureRulesTests test",
    "./mvnw test",
    "加载根 .env 后运行 MySQL 8.4 专项集成测试"
  ],
  "userGates": [
    {
      "name": "SPEC_CONFIRMATION",
      "status": "SATISFIED",
      "evidenceRefs": [
        "user-message:确认采用建议的会话策略并继续实现",
        "travel-context-api-clarification-005:ACCEPTED"
      ]
    }
  ],
  "gitGates": [
    {
      "name": "GIT_WRITE",
      "status": "NOT_APPLICABLE",
      "evidenceRefs": []
    }
  ],
  "status": "ISSUED",
  "persistedBy": "main_agent"
}
